{
  "sourceId": "wikipedia-list-universities-syria",
  "sourceTitle": "Wikipedia: List of universities and colleges in Syria",
  "sourceUrl": "https://en.wikipedia.org/wiki/List_of_universities_and_colleges_in_Syria",
  "license": "CC BY-SA 4.0",
  "licenseUrl": "https://creativecommons.org/licenses/by-sa/4.0/",
  "accessedAt": "2026-06-29T00:00:00.000Z",
  "status": "reviewed",
  "rawFiles": [
    {
      "name": "outputs/universities/wikipedia-list-candidates.json",
      "sha256": "27d1ced935b72b048d4d1bc54105184fedd217a23414509d7108343afc710823",
      "notes": "Local automation candidate output retained in data-automation."
    },
    {
      "name": "outputs/universities/seed-review-gaps.json",
      "sha256": "fb1dc10aabf8070c79b0ff7658003ff1bbac1de43d17b403ce0e8b78146ef890",
      "notes": "Local held-candidate review artifact retained in data-automation."
    },
    {
      "name": "outputs/universities/source-comparison-report.json",
      "sha256": "2f2a5d8dc3bc97239c36e40e2737406a49bba36a60c90118d14840a5cb27691a",
      "notes": "Reviewed comparison artifact used to confirm this candidate was held out of the seed export."
    }
  ],
  "importedFields": ["name", "institutionType", "location", "website"],
  "targetFiles": ["data/universities.json"],
  "transforms": [
    "Selected the tracked foreign-branch candidate from the post-seed Wikipedia candidate batch.",
    "Set institutionType to other for the foreign public university branch.",
    "Set foundedYear to null because the source row did not provide an established year.",
    "Parsed the source table Website value into https://oiu.edu.sd/ and retained it as the source-listed parent university website.",
    "Kept Arabic name absent because the approved source batch did not provide a source-backed Arabic name.",
    "Imported only source-backed locality values and did not infer governorates."
  ],
  "reviewNotes": "Fourth candidate-record batch import. The record remains sourced to the approved Wikipedia list source with CC BY-SA attribution retained through the source registry."
}
