{
  "sourceId": "wikipedia-list-universities-syria",
  "sourceTitle": "Wikipedia: List of universities and colleges in Syria",
  "sourceUrl": "https://en.wikipedia.org/wiki/List_of_universities_and_colleges_in_Syria",
  "license": "CC BY-SA 4.0",
  "licenseUrl": "https://creativecommons.org/licenses/by-sa/4.0/",
  "accessedAt": "2026-06-29T00:00:00.000Z",
  "status": "superseded",
  "rawFiles": [
    {
      "name": "outputs/universities/wikipedia-list-candidates.json",
      "sha256": "27d1ced935b72b048d4d1bc54105184fedd217a23414509d7108343afc710823",
      "notes": "Local automation candidate output retained in data-automation."
    },
    {
      "name": "outputs/universities/seed-review-gaps.json",
      "sha256": "fb1dc10aabf8070c79b0ff7658003ff1bbac1de43d17b403ce0e8b78146ef890",
      "notes": "Local held-candidate review artifact retained in data-automation."
    },
    {
      "name": "outputs/universities/source-comparison-report.json",
      "sha256": "2f2a5d8dc3bc97239c36e40e2737406a49bba36a60c90118d14840a5cb27691a",
      "notes": "Reviewed comparison artifact used to confirm these candidates were held out of the seed export."
    }
  ],
  "importedFields": ["name", "institutionType", "location", "foundedYear"],
  "targetFiles": ["data/universities.json"],
  "transforms": [
    "Selected military and police candidates from the post-seed Wikipedia candidate batch.",
    "Deferred sy-homs-military-academy because the local Wikipedia and Wikidata artifacts disagree on the founded year.",
    "Set institutionType to other for military and police institutions.",
    "Kept Arabic names absent because this batch uses only the approved Wikipedia list artifact and it did not provide source-backed Arabic names.",
    "Kept websites null because no approved public source confirmed official websites for these records.",
    "Imported only source-backed locality values and did not infer governorates.",
    "v0.1.11 restored the production boundary to records approved for the seed scope and moved out-of-scope additions back to the held-candidate backlog."
  ],
  "reviewNotes": "Reviewed public-source military and police candidate batch. Superseded by v0.1.11 because these candidates are outside the current approved scope; retained in the held-candidate backlog."
}
