{
  "sourceId": "wikidata",
  "sourceTitle": "Wikidata",
  "sourceUrl": "https://www.wikidata.org/wiki/Q114672251",
  "license": "CC0 1.0",
  "licenseUrl": "https://www.wikidata.org/wiki/Wikidata:Licensing",
  "accessedAt": "2026-06-29T00:00:00.000Z",
  "status": "superseded",
  "rawFiles": [
    {
      "name": "https://www.wikidata.org/wiki/Special:EntityData/Q114672251.json",
      "notes": "Live Wikidata entity export showed the Kurdish label for University of Kobani and the 2017 inception claim."
    },
    {
      "name": "outputs/universities/wikidata-candidates.json",
      "sha256": "ac646013f90fe0362ce2c8aa051bd0f1465c8a6b044035126881b1dfa7f25481",
      "notes": "Local automation candidate output retained in data-automation."
    },
    {
      "name": "outputs/universities/seed-review-gaps.json",
      "sha256": "fb1dc10aabf8070c79b0ff7658003ff1bbac1de43d17b403ce0e8b78146ef890",
      "notes": "Local held-candidate review artifact retained in data-automation."
    }
  ],
  "importedFields": ["externalIds", "sourceIds"],
  "targetFiles": ["data/universities.json"],
  "transforms": [
    "Merged Wikidata Q114672251 into sy-university-of-kobani as a duplicate/enrichment identifier.",
    "Did not create a new record because the existing University of Kobani record already represents the institution.",
    "Did not import Kurdish aliases because the canonical alias language schema currently accepts only ar, en, and und.",
    "v0.1.11 restored the production boundary to records present in the internal comparison control list and moved non-control-list additions back to the held-candidate backlog."
  ],
  "reviewNotes": "Reviewed Wikidata duplicate/enrichment candidate for University of Kobani. Superseded by v0.1.11 because the canonical University of Kobani candidate is held outside the current internal control-list boundary."
}
