{
  "sourceId": "wikidata",
  "sourceTitle": "Wikidata",
  "sourceUrl": "https://www.wikidata.org/",
  "license": "CC0 1.0",
  "licenseUrl": "https://www.wikidata.org/wiki/Wikidata:Licensing",
  "accessedAt": "2026-06-29T00:00:00.000Z",
  "status": "reviewed",
  "rawFiles": [
    {
      "name": "outputs/universities/wikidata-candidates.json",
      "sha256": "ac646013f90fe0362ce2c8aa051bd0f1465c8a6b044035126881b1dfa7f25481",
      "notes": "Local automation candidate output retained in data-automation."
    },
    {
      "name": "outputs/universities/seed-review-gaps.json",
      "sha256": "fb1dc10aabf8070c79b0ff7658003ff1bbac1de43d17b403ce0e8b78146ef890",
      "notes": "Local held-candidate review artifact retained in data-automation."
    },
    {
      "name": "outputs/universities/source-comparison-report.json",
      "sha256": "2f2a5d8dc3bc97239c36e40e2737406a49bba36a60c90118d14840a5cb27691a",
      "notes": "Reviewed comparison artifact used to identify duplicate/enrichment candidates."
    }
  ],
  "importedFields": ["aliases", "externalIds", "location", "sourceIds"],
  "targetFiles": ["data/universities.json"],
  "transforms": [
    "Merged sy-al-shahbaa-university into sy-al-shahba-university as an alternate English spelling, corrected Arabic spelling, Wikidata identifier, and source-backed centroid.",
    "Merged Wikidata Q28715211 into sy-bilad-al-sham-university-for-sharia-sciences as an Arabic alias and Wikidata identifier.",
    "Did not create new records for these candidates because existing canonical records already represent the institutions."
  ],
  "reviewNotes": "Duplicate/enrichment cleanup for held Wikidata-only candidates. The retained changes enrich existing approved seed records and do not create new canonical institutions."
}
