{
  "sourceId": "wikipedia-list-universities-syria",
  "sourceTitle": "Wikipedia: List of universities and colleges in Syria",
  "sourceUrl": "https://en.wikipedia.org/wiki/List_of_universities_and_colleges_in_Syria",
  "license": "CC BY-SA 4.0",
  "licenseUrl": "https://creativecommons.org/licenses/by-sa/4.0/",
  "accessedAt": "2026-06-29T00:00:00.000Z",
  "status": "reviewed",
  "rawFiles": [
    {
      "name": "outputs/universities/wikipedia-list-candidates.json",
      "sha256": "27d1ced935b72b048d4d1bc54105184fedd217a23414509d7108343afc710823",
      "notes": "Local automation candidate output retained in data-automation."
    },
    {
      "name": "outputs/universities/source-comparison-report.json",
      "sha256": "2f2a5d8dc3bc97239c36e40e2737406a49bba36a60c90118d14840a5cb27691a",
      "notes": "Reviewed merge artifact used for seed export."
    }
  ],
  "importedFields": ["name", "institutionType", "location", "foundedYear", "website"],
  "targetFiles": ["data/sources.json", "data/universities.json"],
  "transforms": [
    "Collected the Wikipedia list page through the MediaWiki API using local data-automation.",
    "Compared sectioned list rows with Wikidata, the internal comparison control list, and maintainer review decisions.",
    "Exported only internal control-list seed records with approved public source IDs."
  ],
  "reviewNotes": "Initial seed import. CC BY-SA attribution is retained through the source registry."
}
